job_posting_id,title,description,location
76779b89-1ec9-4129-9d9a-c86518ce7756,FP&A Analyst,"Voleon is a technology company that applies state-of-the-art AI and machine learning techniques to real-world problems in finance. For nearly two decades, we have led our industry and worked at the frontier of applying AI/ML to investment management. We have become a multibillion-dollar asset manager, and we have ambitious goals for the future.
  
Your colleagues will include internationally recognized experts in artificial intelligence and machine learning research as well as highly experienced finance and technology professionals.  The people who shape our company come from other backgrounds, including concert music performances, humanitarian aid, opera singing, sports writing, and BMX racing. You will be part of a team that loves to succeed together.

In addition to our enriching and collegial working environment, we offer highly competitive compensation and benefits packages, technology talks by our experts, a beautiful modern office, daily catered lunches, and more.


As Voleon’s FP&A Analyst you will be responsible for financial reporting, analysis and forecasting. You will collaborate with cross functional business partners on budget vs actual analysis, building financial models for new initiatives and projects required by leadership. Using your deep expertise in forecasting and BI tools, you will provide a key role in improving financial processes and outcomes. Strong analytical skills, financial modeling proficiency, adaptability, and exacting attention to detail are essential for this role.
","Berkeley, CA"
c17e173f-0806-47aa-902b-d76dac07de75,Financial Analyst II,"Candidates must possess recent Navy shipboard Financial Management experience, defined as experience acquired within the past 5 years. Key competencies include:

Experience serving as an OPTAR Financial Records Keeper, including generating Budget OPTAR Reports (BOR) and Financial Transmittal (TL) reports, along with other required monthly financial reports in accordance with CNSP guidelines.

Familiarity with the Government-wide Commercial Purchase Card Program (GCPC), including roles as Approving Official (AO) and Cardholder, along with thorough knowledge of GCPC regulations and processes.

Demonstrated experience utilizing RSUPPLY, One Touch Supply (OTS), and other pertinent Supply and Logistics systems and programs.

Documented familiarity with Military Standard Requisitioning and Issue Procedures (MILSTRIP) and Military Standard Transaction Reporting and Accounting Procedures (MILSTRAP).

Experience processing monthly Obligation Validation Reports (OVR), previously known as Unfilled Order Listing (UOL), and Difference Listings (DL), e
","San Diego, CA"
8f51222a-f3a7-46c9-b24d-2443ee0727e5,Financial Analyst (DoD Audit & ERP),"Significance is a woman-owned consulting firm serving the federal government.  We are known for building trusted relationships within our teams and with our clients and hiring the highest-level experts who implement innovative solutions. We also like to have fun!  Our focus on culture has contributed to Significance being named a Washington Business Journal Best Place to Work each of the last seven years. 


Significance, Inc is seeking a Financial Analyst to join our growing team!  The Financial Analyst provides day-to-day financial reconciliation and reporting support using AI/ML-driven dashboards and tools embedded in Advana Mercury. This role assists senior analysts with financial disclosures, inventory reconciliation, and audit remediation while validating outputs from automated systems.
","New Cumberland, PA"
5728e288-66d0-437d-a20b-794d1a082985,Senior Operations Financial Analyst,"About Fluence: Fluence (Nasdaq: FLNC) is a global market leader delivering intelligent energy storage and optimization software for renewables and storage. Our solutions and operational services are helping to create a more resilient grid and unlock the full potential of renewable portfolios. With gigawatts of successful implementations across nearly 50 markets, we are transforming the way we power our world for a more sustainable future. For more information, please visit fluenceenergy.com.
 
Our Culture
At Fluence, our culture is the foundation that drives our ambitious growth strategy and fuels our mission to transform the future of energy. Our core cultural pillars empower us to innovate, collaborate, and lead with purpose, ensuring we continue to deliver unparalleled value to our customers and the world.

Unleash Voices
We believe every voice matters. We encourage openness, active listening, and decisive action to create a culture where everyone has the opportunity to contribute to our success. We foster an environment where diverse perspectives are heard and valued, driving innovation and progress.

Customer Fluent
Our customers are at the heart of everything we do. We’re committed to delivering exceptional value that exceeds expectations by understanding our customers' needs and adapting swiftly to meet them. Our deep focus on customer satisfaction drives us to continuously improve and innovate.

Infinite Impact
We are committed to creating the impossible. We push boundaries to deliver sustainable, game-changing solutions that shape a brighter, more energy-efficient future for all. Our team is passionate about making a lasting impact that will resonate for generations to come.

All In
We are all in for growth. Our teams are relentlessly focused on identifying and seizing opportunities that propel us forward. We embrace an ownership mindset, pushing ourselves and each other to accelerate progress and create lasting success.


Position Summary
The Senior Operations Financial Analyst will play a critical role in supporting the Product and Operations Finance team by providing in-depth financial modeling, cost management analysis, and risk assessment to enable data-driven decision-making. This position requires strong expertise in product cost management, non-conformance cost (NCC) tracking, and risk management within a complex global operations environment. The analyst will partner closely with Product, Supply Chain, Operations, and Finance leadership to drive financial transparency, identify cost efficiencies, and mitigate operational and financial risks.

Key Responsibilities
•Lead financial modeling to support product costing, margin analysis, and operational planning.
•Own and enhance the tracking, reporting, and forecasting of non-conformance costs (NCC) for various product components, ensuring visibility and management accountability.
•Partner with operations and supply chain leaders to drive cost reduction initiatives, product cost variance analysis, and root cause identification.
•Conduct risk assessments on manufacturing, supply chain, and financial operations—providing mitigation recommendations to leadership.
•Develop forward-looking financial models and scenario analyses to evaluate the impact of operational and product strategy decisions.
•Support monthly and quarterly financial reporting cycles, including variance analysis, forecasting, and risk/opportunity reporting.
•Build and automate reporting tools, dashboards, and analysis to improve visibility into product costs and NCC.
•Collaborate with cross-functional teams (Product, Engineering, Supply Chain, Quality, Procurement) to align financial insights with business priorities.
•Provide executive-level presentations and insights to senior leadership, connecting operational drivers to financial outcomes.
•Support the creation of new product business cases through collaboration with key stakeholders while validating key financial assumptions provided by data owners.
•Drive accuracy in product development program forecasting through data driven analysis and data transparency to the program managers.
•Support annual budget cycle for both labor and non-labor spend as it relates to the product development programs.

Qualifications
•Bachelor’s degree in Finance, Accounting, Economics, or related field; MBA, CFA, or CPA preferred.
•5+ years of experience in financial analysis, preferably in product or operations finance.
•Strong background in product cost management, operational finance, and manufacturing economics.
•Demonstrated experience managing and reporting non-conformance costs and driving corrective action processes.
•Advanced financial modeling, scenario planning, and analytical skills with proven ability to translate complex data into actionable insights.
•Strong understanding of risk management principles within operational and financial environments.
•High proficiency in Excel and financial planning/ERP tools (SAP, Oracle, Anaplan, or similar).
•Excellent communication and business partnering skills, with a track record of influencing non-finance leaders.
•Ability to work independently in a fast-paced, global environment while managing multiple priorities.
Key Competencies
•Strategic and analytical mindset with operational focus
•Strong problem-solving and process improvement orientation
•Attention to detail with ability to connect big-picture business impacts
•Strong collaboration, influencing, and stakeholder management

","Arlington, VA, USA"
